{
  "schema_version": 1,
  "number": "INV-0000000002",
  "status": "issued",

  "type": "invoice",
  "title": "Example Project / January 2026",
  "issue_date": "2026-01-15",
  "due_date": "2026-01-22",
  "currency": "EUR",
  "language": "de",

  "issuer": {
    "legal_name": "Example Issuer EOOD",
    "address": {
      "line1": "Musterstraße 1",
      "postal_code": "9000",
      "city": "Varna",
      "country_code": "BG"
    },
    "tax_id": "000000000",
    "vat_id": "BG000000000",
    "bank": {
      "name": "Example Bank",
      "iban": "DE89370400440532013000",
      "bic": "COBADEFFXXX"
    },
    "logo": "static/logo.svg",
    "default_currency": "EUR"
  },
  "recipient": {
    "number": 2,
    "legal_name": "Musterfirma GmbH",
    "address": {
      "line1": "Musterstraße 1",
      "postal_code": "1010",
      "city": "Wien",
      "country_code": "AT"
    },
    "tax_id": "ATU00000000",
    "vat_id": "ATU00000000",
    "is_business": true,
    "language": "de",
    "payment_terms_days": 30,
    "email": "buchhaltung@musterfirma.example"
  },

  "lines": [
    {
      "description": {
        "de": "Beispielprojekt - Betrieb und Weiterentwicklung",
        "bg": "Примерен проект – експлоатация и по-нататъшно развитие"
      },
      "quantity": 13600,
      "unit": "hrs",
      "unit_price": 7500,
      "vat_rate": 0
    }
  ],

  "tax": {
    "regime": "eu_b2b_reverse_charge",
    "citations": ["ЗДДС чл. 21 ал. 2", "ЗДДС чл. 86 ал. 3"],
    "note": {
      "de": "Steuerschuldnerschaft des Leistungsempfängers (Reverse Charge). Keine Umsatzsteuer gemäß Art. 21 Abs. 2 und Art. 86 Abs. 3 ЗДДС.",
      "bg": "Данъкът не е начислен на основание чл. 21, ал. 2 и чл. 86, ал. 3 ЗДДС. Данъкът е изискуем от получателя (обратно начисляване)."
    }
  }
}
